{
  "countryName": "Ocean Accounts Template",
  "countryCode": "TMP",
  "lastUpdated": "2025-01-15",
  "ecosystems": {
    "coralReef": 150000,
    "reefFlats": 80000,
    "seagrass": 45000,
    "mangroves": 35000,
    "algae": 12000,
    "tidalWetlands": 8000,
    "other": null
  },
  "metadata": {
    "dataSource": "Template Marine Survey 2024",
    "methodology": "Satellite remote sensing with ground validation",
    "referenceYear": 2024,
    "spatialResolution": "10m",
    "uncertaintyRange": "±5%"
  },
  "ecosystemServices": {
    "ecosystems": [
      {
        "ecosystem": "coralReef",
        "ecosystemLabel": "Coral Reefs",
        "metrics": [
          {
            "id": "area",
            "label": "Area",
            "unit": "thousand hectares",
            "values": [
              { "year": 2018, "value": 125 },
              { "year": 2021, "value": 122 }
            ]
          },
          {
            "id": "condition",
            "label": "Condition Index",
            "unit": "%",
            "values": [
              { "year": 2018, "value": 42 },
              { "year": 2021, "value": 46 }
            ]
          },
          {
            "id": "value",
            "label": "Ecosystem Service Value",
            "unit": "billion USD",
            "values": [
              { "year": 2018, "value": 1850 },
              { "year": 2021, "value": 1920 }
            ]
          }
        ]
      },
      {
        "ecosystem": "seagrass",
        "ecosystemLabel": "Seagrass Meadows",
        "metrics": [
          {
            "id": "area",
            "label": "Area",
            "unit": "thousand hectares",
            "values": [
              { "year": 2018, "value": 88 },
              { "year": 2021, "value": 84 }
            ]
          },
          {
            "id": "value",
            "label": "Ecosystem Service Value",
            "unit": "billion USD",
            "values": [
              { "year": 2018, "value": 680 },
              { "year": 2021, "value": 665 }
            ]
          }
        ]
      },
      {
        "ecosystem": "mangroves",
        "ecosystemLabel": "Mangrove Forests",
        "metrics": [
          {
            "id": "area",
            "label": "Area",
            "unit": "thousand hectares",
            "values": [
              { "year": 2018, "value": 62 },
              { "year": 2021, "value": 61 }
            ]
          },
          {
            "id": "value",
            "label": "Ecosystem Service Value",
            "unit": "billion USD",
            "values": [
              { "year": 2018, "value": 420 },
              { "year": 2021, "value": 430 }
            ]
          }
        ]
      }
    ],
    "metadata": {
      "dataSource": "Ocean Accounts Program Office 2023",
      "methodology": "Satellite analysis for extent, hedonic pricing for ecosystem service values",
      "notes": "Values in 2021 USD constant prices"
    }
  },
  "naturalCapital": {
    "year": 2023,
    "title": "Marine Natural Inputs Powering Blue Economy",
    "categories": [
      {
        "id": "fish",
        "label": "Wild Fish & Shellfish",
        "unit": "thousand tonnes",
        "provision": 2800,
        "usage": {
          "marine_industry": 1900,
          "fisheries": 900
        }
      },
      {
        "id": "seaweed",
        "label": "Seaweed & Macroalgae",
        "unit": "thousand tonnes",
        "provision": 520,
        "usage": {
          "biotechnology": 380,
          "fisheries": 140
        }
      },
      {
        "id": "sand_stone",
        "label": "Sand & Aggregates",
        "unit": "million cubic meters",
        "provision": 22,
        "usage": {
          "energy_minerals": 18,
          "marine_industry": 4
        }
      },
      {
        "id": "energy",
        "label": "Renewable Marine Energy",
        "unit": "GWh",
        "provision": 52,
        "usage": {
          "energy_minerals": 45,
          "others": 7
        }
      },
      {
        "id": "salt",
        "label": "Salt & Minerals",
        "unit": "thousand tonnes",
        "provision": 185,
        "usage": {
          "chemical_industry": 150,
          "food_processing": 35
        }
      }
    ],
    "clusters": {
      "marine_industry": "Marine Industries",
      "fisheries": "Fisheries & Aquaculture",
      "energy_minerals": "Energy & Minerals",
      "biotechnology": "Biotechnology",
      "chemical_industry": "Chemical & Pharma",
      "food_processing": "Food Processing",
      "others": "Other uses"
    },
    "metadata": {
      "dataSource": "Marine Affairs Program Annual Report 2023",
      "notes": "Units vary by resource type; provision estimates based on production surveys"
    }
  },
  "social": {
    "lastUpdated": "2025-01-15",
    "spotlightAtollId": "alpha-cluster",
    "indicators": [
      {
        "id": "populationSize",
        "label": "Population Size",
        "shortLabel": "Pop.",
        "description": "Total population",
        "icon": "population",
        "unit": "number",
        "tierLabels": {"low": "< 500", "moderate": "500-1000", "high": "> 1000"}
      },
      {
        "id": "youthPopulationShare",
        "label": "Youth Population Share",
        "shortLabel": "Youth %",
        "description": "Percentage aged 0-14",
        "icon": "youth",
        "unit": "percentage",
        "tierLabels": {"low": "< 15%", "moderate": "15-25%", "high": "> 25%"}
      },
      {
        "id": "tourismEmploymentShare",
        "label": "Tourism Employment",
        "shortLabel": "Tourism",
        "description": "Percentage in tourism",
        "icon": "tourism",
        "unit": "percentage",
        "tierLabels": {"low": "< 10%", "moderate": "10-30%", "high": "> 30%"}
      },
      {
        "id": "fishingIncomeDependency",
        "label": "Fishing Income Dependency",
        "shortLabel": "Fishing",
        "description": "Income dependent on fishing",
        "icon": "boat",
        "unit": "percentage",
        "tierLabels": {"low": "< 30%", "moderate": "30-60%", "high": "> 60%"}
      },
      {
        "id": "foodSecurityDependence",
        "label": "Food Security Dependence",
        "shortLabel": "Food Sec.",
        "description": "Reliance on local fish",
        "icon": "meal",
        "unit": "percentage",
        "tierLabels": {"low": "< 40%", "moderate": "40-70%", "high": "> 70%"}
      },
      {
        "id": "coastalDamageExposure",
        "label": "Coastal Damage Exposure",
        "shortLabel": "Coastal Risk",
        "description": "Coastal hazard exposure",
        "icon": "wave",
        "unit": "percentage",
        "tierLabels": {"low": "< 15%", "moderate": "15-40%", "high": "> 40%"}
      },
      {
        "id": "weeklyFishSeafoodSpend",
        "label": "Weekly Fish Spending",
        "shortLabel": "Spend",
        "description": "Weekly seafood spending",
        "icon": "currency",
        "unit": "currency",
        "tierLabels": {"low": "< $20", "moderate": "$20-50", "high": "> $50"}
      },
      {
        "id": "stormSurgeExposure",
        "label": "Storm Surge Exposure",
        "shortLabel": "Storm Risk",
        "description": "Storm surge risk",
        "icon": "damage",
        "unit": "percentage",
        "tierLabels": {"low": "< 10%", "moderate": "10-30%", "high": "> 30%"}
      }
    ],
    "atolls": [
      {
        "id": "alpha-cluster",
        "name": "Alpha Cluster",
        "isSpotlight": true,
        "population": 2340,
        "metrics": {
          "populationSize": {"value": 2340, "tier": "moderate", "iconCount": 2, "percentile": 0.55},
          "youthPopulationShare": {"value": 18.5, "tier": "moderate", "iconCount": 2, "percentile": 0.45},
          "tourismEmploymentShare": {"value": 22.0, "tier": "moderate", "iconCount": 2, "percentile": 0.55},
          "fishingIncomeDependency": {"value": 45.0, "tier": "moderate", "iconCount": 2, "percentile": 0.5},
          "foodSecurityDependence": {"value": 58.0, "tier": "moderate", "iconCount": 2, "percentile": 0.48},
          "coastalDamageExposure": {"value": 28.0, "tier": "moderate", "iconCount": 2, "percentile": 0.52},
          "weeklyFishSeafoodSpend": {"value": 35.0, "tier": "moderate", "iconCount": 2, "percentile": 0.5},
          "stormSurgeExposure": {"value": 22.0, "tier": "moderate", "iconCount": 2, "percentile": 0.45}
        }
      },
      {
        "id": "beta-cluster",
        "name": "Beta Cluster",
        "isSpotlight": false,
        "population": 1850,
        "metrics": {
          "populationSize": {"value": 1850, "tier": "low", "iconCount": 1, "percentile": 0.3},
          "youthPopulationShare": {"value": 21.5, "tier": "high", "iconCount": 3, "percentile": 0.75},
          "tourismEmploymentShare": {"value": 18.0, "tier": "low", "iconCount": 1, "percentile": 0.35},
          "fishingIncomeDependency": {"value": 52.0, "tier": "moderate", "iconCount": 2, "percentile": 0.6},
          "foodSecurityDependence": {"value": 65.0, "tier": "high", "iconCount": 3, "percentile": 0.65},
          "coastalDamageExposure": {"value": 35.0, "tier": "high", "iconCount": 3, "percentile": 0.7},
          "weeklyFishSeafoodSpend": {"value": 32.0, "tier": "moderate", "iconCount": 2, "percentile": 0.45},
          "stormSurgeExposure": {"value": 28.0, "tier": "moderate", "iconCount": 2, "percentile": 0.55}
        }
      },
      {
        "id": "gamma-cluster",
        "name": "Gamma Cluster",
        "isSpotlight": false,
        "population": 2120,
        "metrics": {
          "populationSize": {"value": 2120, "tier": "moderate", "iconCount": 2, "percentile": 0.5},
          "youthPopulationShare": {"value": 16.2, "tier": "low", "iconCount": 1, "percentile": 0.2},
          "tourismEmploymentShare": {"value": 28.5, "tier": "high", "iconCount": 3, "percentile": 0.8},
          "fishingIncomeDependency": {"value": 38.0, "tier": "low", "iconCount": 1, "percentile": 0.25},